{
  "schemaVersion": "burin-labs.candidate_manifest.v1",
  "repository": "burin-labs/harn",
  "sourceCommit": "0e926289a777480b70c5fe9b29c6b67585559030",
  "runId": "35858262708",
  "runAttempt": "1",
  "artifacts": [
    {
      "kind": "archive",
      "target": "aarch64-apple-darwin",
      "artifact": "harn-aarch64-apple-darwin",
      "file": "harn-aarch64-apple-darwin.tar.gz",
      "sha256": "79a028b27c35245cbbb52c7c088ef7d694f151a5f075ca337b80a96b77653ecf",
      "attestationPredicateType": "https://harnlang.com/attestations/release-archive/v1",
      "signingStatus": "signed",
      "notarizationStatus": "notarized"
    },
    {
      "kind": "archive",
      "target": "aarch64-unknown-linux-gnu",
      "artifact": "harn-aarch64-unknown-linux-gnu",
      "file": "harn-aarch64-unknown-linux-gnu.tar.gz",
      "sha256": "4c0e3a14a2af2bd1fd524f7dd07aec12af3dff7a2cc4385afa7ed785878b1a63",
      "attestationPredicateType": "https://harnlang.com/attestations/release-archive/v1",
      "signingStatus": "not_applicable",
      "notarizationStatus": "not_applicable"
    },
    {
      "kind": "archive",
      "target": "x86_64-apple-darwin",
      "artifact": "harn-x86_64-apple-darwin",
      "file": "harn-x86_64-apple-darwin.tar.gz",
      "sha256": "ef19168eef8c12636d7638b0806f17be3fa8d393bfda1cbc75ec5305eba03d62",
      "attestationPredicateType": "https://harnlang.com/attestations/release-archive/v1",
      "signingStatus": "signed",
      "notarizationStatus": "notarized"
    },
    {
      "kind": "archive",
      "target": "x86_64-pc-windows-msvc",
      "artifact": "harn-x86_64-pc-windows-msvc",
      "file": "harn-x86_64-pc-windows-msvc.zip",
      "sha256": "370a5c8e48db696d5e8d611c48b0e20bbe9b81f353294078e6f037f214bf5141",
      "attestationPredicateType": "https://harnlang.com/attestations/release-archive/v1",
      "signingStatus": "not_applicable",
      "notarizationStatus": "not_applicable"
    },
    {
      "kind": "archive",
      "target": "x86_64-unknown-linux-gnu",
      "artifact": "harn-x86_64-unknown-linux-gnu",
      "file": "harn-x86_64-unknown-linux-gnu.tar.gz",
      "sha256": "8c6f35a689c372c26995ca87b5792ae0c59562333508355535f0d46ddc834dc0",
      "attestationPredicateType": "https://harnlang.com/attestations/release-archive/v1",
      "signingStatus": "not_applicable",
      "notarizationStatus": "not_applicable"
    },
    {
      "kind": "checksums",
      "artifact": "harn-release-files",
      "file": "SHA256SUMS",
      "sha256": "5e1aaf9ce0a1f047a0cceb4e850969e937e449c89fc1ba057ab8917aeb61aac4",
      "attestationPredicateType": "https://harnlang.com/attestations/release-archive/v1",
      "signingStatus": "not_applicable",
      "notarizationStatus": "not_applicable"
    },
    {
      "kind": "asset-index",
      "artifact": "harn-release-files",
      "file": "release-assets.json",
      "sha256": "b50b1ade774f6223d46888b86f5e47ed18a68a22fb50601fa075653e6881cf98",
      "attestationPredicateType": "https://harnlang.com/attestations/release-archive/v1",
      "signingStatus": "not_applicable",
      "notarizationStatus": "not_applicable"
    },
    {
      "kind": "notes",
      "artifact": "harn-release-files",
      "file": "release-notes.md",
      "sha256": "1bc5b39d23bb6515252b05f1d9fe3ff6038977293b11206c3f1a4b4ed1c8752a",
      "attestationPredicateType": "https://harnlang.com/attestations/release-archive/v1",
      "signingStatus": "not_applicable",
      "notarizationStatus": "not_applicable"
    }
  ]
}
